{
  "schema_version": 1,
  "contract_id": "ft.rch_worker_storage_recovery_proof.v1",
  "generated_at_ms": 1779664748000,
  "proof_id": "blocked-hard-preflight-no-admissible",
  "source_bead": "ft-5xwsu.3",
  "approval_contract_id": "ft.rch_worker_storage_approval.v1",
  "approval_artifact_path": "artifacts/rch-worker-storage-approval/20260518T040000Z/approved-candidate.json",
  "approval_artifact_sha256": "9696969696969696969696969696969696969696969696969696969696969696",
  "operator_recovery_reference": "operator://jemanuel/rch-worker-storage/20260518T050000Z",
  "gate_result": "blocked_no_admissible_worker",
  "admission_recovered": false,
  "ft4tp7g_closeout_allowed": false,
  "stable_reason_code": "insufficient_slots=3,hard_preflight=1",
  "agent_side_effect_policy": {
    "read_only_evidence_collection": true,
    "agent_performed_recovery": false,
    "agent_mail_repaired": false,
    "agent_mail_restarted": false,
    "rch_daemon_restarted": false,
    "worker_mutated_by_agent": false,
    "build_cancelled": false,
    "files_deleted_by_agent": false,
    "remote_mirror_mutated": false,
    "local_cargo_counted_as_proof": false
  },
  "rch_status": {
    "command": "RCH_NO_SELF_HEALING=1 rch --no-self-healing --json status --workers --jobs",
    "rch_version": "1.0.26",
    "daemon_posture": "degraded",
    "workers_total": 8,
    "workers_healthy": 7,
    "available_slots": 54,
    "active_builds": 0,
    "queued_builds": 0,
    "critical_pressure_workers": 0,
    "telemetry_gap_workers": 1,
    "artifact_path": "artifacts/rch-worker-storage-recovery-proof/20260524T231900Z/status-workers-jobs.json",
    "artifact_sha256": "9797979797979797979797979797979797979797979797979797979797979797"
  },
  "remote_required_dry_run": {
    "required": true,
    "command": "RCH_REQUIRE_REMOTE=1 RCH_NO_SELF_HEALING=1 rch --no-self-healing diagnose --json --dry-run -- env CARGO_TARGET_DIR=/tmp/ft-5xwsu3-hard-preflight-dryrun CARGO_BUILD_JOBS=1 CARGO_INCREMENTAL=0 cargo test -p frankenterm-core-replay-types -- --nocapture",
    "target_dir": "/tmp/ft-5xwsu3-hard-preflight-dryrun",
    "classification": "cargo_test",
    "would_intercept": true,
    "selected_worker": "vmi1264463",
    "selection_reason": "selected_healthy_worker",
    "transfer_state": "skipped_dry_run_only",
    "remote_execution_state": "skipped_dry_run_only",
    "exit_status": null,
    "artifact_path": "artifacts/rch-worker-storage-recovery-proof/20260524T231900Z/dry-run.json",
    "artifact_sha256": "9898989898989898989898989898989898989898989898989898989898989898",
    "remote_cargo_reached": null,
    "remote_rustc_reached": null,
    "test_binary_reached": null
  },
  "remote_required_smoke": {
    "required": true,
    "command": "RCH_REQUIRE_REMOTE=1 RCH_NO_SELF_HEALING=1 rch --no-self-healing exec -- env CARGO_TARGET_DIR=/tmp/ft-5xwsu3-hard-preflight-smoke CARGO_BUILD_JOBS=1 CARGO_INCREMENTAL=0 cargo test -p frankenterm-core-replay-types -- --nocapture",
    "target_dir": "/tmp/ft-5xwsu3-hard-preflight-smoke",
    "classification": "cargo_test",
    "would_intercept": true,
    "selected_worker": null,
    "selection_reason": "no_admissible_workers=insufficient_slots=3,hard_preflight=1",
    "transfer_state": "skipped_no_worker",
    "remote_execution_state": "skipped_no_worker",
    "exit_status": 1,
    "artifact_path": "artifacts/rch-worker-storage-recovery-proof/20260524T231900Z/remote-smoke-hard-preflight.json",
    "artifact_sha256": "9999999999999999999999999999999999999999999999999999999999999999",
    "remote_cargo_reached": false,
    "remote_rustc_reached": false,
    "test_binary_reached": false
  },
  "br_dep_cycles": {
    "command": "br dep cycles --json",
    "count": 0,
    "artifact_path": "artifacts/rch-worker-storage-recovery-proof/20260524T231900Z/br-dep-cycles.json",
    "artifact_sha256": "9a9a9a9a9a9a9a9a9a9a9a9a9a9a9a9a9a9a9a9a9a9a9a9a9a9a9a9a9a9a9a9a"
  },
  "artifact_paths": [
    "artifacts/rch-worker-storage-recovery-proof/20260524T231900Z/status-workers-jobs.json",
    "artifacts/rch-worker-storage-recovery-proof/20260524T231900Z/dry-run.json",
    "artifacts/rch-worker-storage-recovery-proof/20260524T231900Z/remote-smoke-hard-preflight.json",
    "artifacts/rch-worker-storage-recovery-proof/20260524T231900Z/br-dep-cycles.json"
  ],
  "forbidden_actions": [
    "run_local_cargo_as_proof",
    "restart_agent_mail",
    "repair_agent_mail_db",
    "restart_rch_daemon",
    "mutate_rch_worker",
    "cancel_other_agent_build",
    "delete_files_without_approval",
    "run_agent_cleanup",
    "mutate_remote_mirror",
    "destructive_git",
    "close_ft4tp7g_without_remote_evidence"
  ],
  "notes": [
    "Negative fixture: dry-run selected vmi1264463, but the material remote-required smoke found no admissible worker because hard preflight and slot gates failed before transfer or Cargo.",
    "The matching live sample reported no admissible workers: insufficient_slots=3,hard_preflight=1 and refused local fallback."
  ]
}
